{
  "$schema": "http://json-schema.org/draft-07/schema#",
  "$id": "https://github.com/CTJ425/Model-Routing/schema/route.config.schema.json",
  "title": "route.config.json",
  "description": "Per-project configuration for the route plugin. Written to .claude/route.config.json by /route:init. Every key is optional: the hooks deep-merge this file over their own defaults, so a partial file is valid.",
  "type": "object",
  "additionalProperties": false,
  "definitions": {
    "role": {
      "type": "object",
      "additionalProperties": false,
      "properties": {
        "enabled": {
          "type": "boolean",
          "description": "Whether this role may be dispatched. Default true."
        }
      }
    }
  },
  "properties": {
    "$schema": { "type": "string" },
    "version": {
      "type": "integer",
      "description": "Config format version. 2 is current. A file with no version key is a v1 file and /route:init will upgrade it in place.",
      "enum": [2]
    },
    "paths": {
      "type": "object",
      "additionalProperties": false,
      "properties": {
        "prod": {
          "type": "array",
          "description": "Repo-relative production-code locations. A trailing '/' means a directory prefix; anything else is a glob supporting **, * and ?.",
          "items": { "type": "string" }
        },
        "test": {
          "type": "array",
          "description": "Globs identifying test files, which builder may not write.",
          "items": { "type": "string" }
        },
        "docs": {
          "type": "string",
          "description": "Repo-relative directory holding the tracking records."
        },
        "specs": {
          "type": "string",
          "description": "Repo-relative directory holding per-task specs."
        }
      }
    },
    "models": {
      "type": "object",
      "description": "Per-role model override, passed as the Agent call's `model` parameter, which takes a model alias such as haiku, sonnet or opus. It is not validated against a live model list. On Claude Code 2.1.251+ it outranks CLAUDE_CODE_SUBAGENT_MODEL; only CLAUDE_CODE_SUBAGENT_MODEL_FORCE=1 (2.1.257+) overrides it.",
      "additionalProperties": false,
      "properties": {
        "scout": { "type": "string" },
        "builder": { "type": "string" },
        "reviewer": { "type": "string" },
        "scribe": { "type": "string" }
      }
    },
    "bookkeeping": {
      "type": "object",
      "description": "Tracking records. With enabled=false the plugin does model routing only: no scribe, no record class in the guard, no counts in the session brief.",
      "additionalProperties": false,
      "properties": {
        "enabled": { "type": "boolean" },
        "timezone": {
          "type": "string",
          "description": "IANA timezone name written into record timestamps, e.g. UTC or Asia/Taipei."
        },
        "records": {
          "type": "object",
          "description": "Record family -> its hot file and its archive, both relative to paths.docs.",
          "additionalProperties": {
            "type": "object",
            "additionalProperties": false,
            "properties": {
              "hot": { "type": "string" },
              "archive": { "type": "string" },
              "keep": {
                "type": "integer",
                "description": "How many entries stay in the hot file before rolling to the archive.",
                "minimum": 0
              }
            }
          }
        },
        "openTaskPattern": {
          "type": "string",
          "description": "Python regex, applied per task entry with re.MULTILINE. A match means the entry is still open."
        }
      }
    },
    "roles": {
      "type": "object",
      "description": "Per-role dispatch switch. A role with enabled=false is denied by the PreToolUse guard, dropped from the session brief's roster, and not offered by the route skill. The main session's writes in that role's scope no longer ask: production code when builder is off, tracking records when scribe is off. Turning every role off leaves the plugin's guards and audit in place while the session does the work itself.",
      "additionalProperties": false,
      "properties": {
        "scout": { "$ref": "#/definitions/role" },
        "builder": { "$ref": "#/definitions/role" },
        "reviewer": { "$ref": "#/definitions/role" },
        "scribe": { "$ref": "#/definitions/role" }
      }
    },
    "scout": {
      "type": "object",
      "additionalProperties": false,
      "properties": {
        "enabled": {
          "type": "boolean",
          "description": "Legacy alias for roles.scout.enabled, kept so a v1 file keeps working. roles.scout.enabled wins when both are present."
        }
      }
    },
    "language": {
      "type": "object",
      "additionalProperties": false,
      "properties": {
        "artifacts": {
          "type": "string",
          "description": "Language the agents write records and reports in, e.g. en or zh-TW. Code and identifiers stay in English regardless."
        }
      }
    },
    "guard": {
      "type": "object",
      "additionalProperties": false,
      "properties": {
        "mainSeverity": {
          "type": "string",
          "description": "What happens when the main session writes production code or a record. Default off: whether to delegate that work is the main session's call. ask or deny push it to builder or scribe. Does not apply to production code when roles.builder.enabled is false, or while the main context is under guard.builderAtK (except with deny, which always applies); does not apply to records when roles.scribe.enabled is false.",
          "enum": ["ask", "deny", "off"]
        },
        "builderAtK": {
          "type": "integer",
          "description": "Main-session context size, in thousands of tokens, below which the main session writes production code with no ask (Lane 0). At or above it, mainSeverity applies, because each implementation turn replays that context. Default 60, an estimate: fresh-session replays put the builder-only premium at $0.19–0.38 per task, which breaks even at about 56k–89k. 0 always applies mainSeverity. Ignored when mainSeverity is deny.",
          "minimum": 0
        },
        "readKB": {
          "type": "integer",
          "description": "An unbounded main-session Read larger than this many KB gets a cost hint in context. It never blocks or asks. 0 disables the hint.",
          "minimum": 0
        },
        "scoutAt": {
          "type": "integer",
          "description": "Main-session discovery calls before the scout hint. 0 disables it.",
          "minimum": 0
        },
        "builderNeedsSpec": {
          "type": "boolean",
          "description": "Default true. A `builder` dispatch must carry an inline brief (a `Files:` and a `Verify:` line) or the path of a spec file with a `## Files` section, and that list must name at least one path, or the guard denies the dispatch. The builder may then write only the files that list names (a path, a directory ending in /, or a glob). Set false to turn both checks off."
        },
        "bashWriteDetection": {
          "type": "boolean",
          "description": "Heuristic detection of filesystem writes issued through Bash. Best-effort by construction."
        }
      }
    },
    "review": {
      "type": "object",
      "additionalProperties": false,
      "properties": {
        "policy": {
          "type": "string",
          "description": "always = review every builder round; risk = review when a trigger fires; never = the test is the only gate.",
          "enum": ["always", "risk", "never"]
        },
        "nudge": {
          "type": "boolean",
          "description": "Whether the review-policy reminders are injected: after a builder dispatch returns, and after the main session's first production-code write since the last reviewer dispatch. Reminders only; nothing blocks."
        },
        "triggers": {
          "type": "array",
          "description": "Replaces the skill's default risk triggers when present. Empty means no automatic risk trigger.",
          "items": {
            "type": "string",
            "enum": [
              "no_red_green",
              "persistent_state",
              "authorization",
              "boundary",
              "silent_calculation",
              "control_flow",
              "builder_blocker"
            ]
          }
        }
      }
    },
    "audit": {
      "type": "object",
      "additionalProperties": false,
      "properties": {
        "charsPerToken": {
          "type": "number",
          "description": "Characters per token used by /route:delta. 4 suits English; CJK text is nearer 1.5. Calibrate with `dispatch_delta.py --validate`.",
          "exclusiveMinimum": 0
        },
        "pricingFile": {
          "type": "string",
          "description": "Path to a pricing table replacing the plugin's scripts/pricing.json. Relative paths resolve from the project root."
        }
      }
    }
  }
}
